<dados xmlns:xsi="http://www.w3.org/2001/XMLSchema-instance"
       xsi:noNamespaceSchemaLocation="schema.xsd">
  <linha>
    <ID>1</ID>
    <Nome>Tivoli</Nome>
    <Estrelas>2</Estrelas>
    <Area>Internet</Area>
    <Endereco>Beira</Endereco>
    <Distancia>0.2</Distancia>
    <Disponibilidade>true</Disponibilidade>
  </linha>
  <linha>
    <ID>2</ID>
    <Nome>Mocambique</Nome>
    <Estrelas>4</Estrelas>
    <Area>Ginasio</Area>
    <Endereco>Baixa</Endereco>
    <Disponibilidade>false</Disponibilidade>
  </linha>
  <linha>
    <ID>3</ID>
    <Nome>Sena</Nome>
    <Estrelas>5</Estrelas>
    <Area>Restaurante</Area>
    <Endereco>Macuti</Endereco>
    <Disponibilidade>false</Disponibilidade>
  </linha>
  <linha>
    <ID>4</ID>
    <Nome>Vip</Nome>
    <Estrelas>3</Estrelas>
    <Area>Parqueamento</Area>
    <Endereco>Chaimite</Endereco>
    <Distancia>0.6</Distancia>
    <Disponibilidade>true</Disponibilidade>
  </linha>
</dados>